{
  "$schema": "http://json-schema.org/draft-07/schema#",
  "$id": "https://reformer.dev/schemas/reformer-builder-config",
  "title": "ReFormer Builder config",
  "description": "Конфиг билдера из .ui_builder/config.json: уровень запуска (читает лаунчер) и уровень проекта (читается при открытии; defaults, preset, presetChoices, profiles и plugins действуют только на уровне запуска). Все секции опциональны; отсутствие — встроенные дефолты.",
  "type": "object",
  "additionalProperties": false,
  "properties": {
    "$schema": { "type": "string" },
    "branding": {
      "type": "object",
      "additionalProperties": false,
      "properties": {
        "title": {
          "type": "string",
          "minLength": 1,
          "description": "Заголовок окна билдера."
        }
      }
    },
    "defaults": {
      "type": "object",
      "additionalProperties": false,
      "description": "Значения, действующие пока человек не выбрал свои в настройках. Применяются только на уровне запуска.",
      "properties": {
        "locale": {
          "type": "string",
          "enum": ["ru", "en"],
          "description": "Локаль интерфейса до первого выбора."
        },
        "theme": {
          "type": "string",
          "enum": ["light", "dark", "system"],
          "description": "Тема до первого выбора."
        },
        "settings": {
          "type": "object",
          "propertyNames": { "minLength": 1 },
          "description": "Умолчания любых настроек: ключ настройки → значение. Действуют, пока человек не выбрал своё, поверх умолчаний плагинов. Пример: {\"plugin.kits.active\": \"hexa-ui\"} — кит организации."
        }
      }
    },
    "preset": {
      "type": "string",
      "minLength": 1,
      "description": "Профиль состава: из каких плагинов собрать приложение. Встроенные: builder (умолчание — основа и киты), builder.base; или id своего профиля из profiles. Движки форм в профиль не входят — это плагины проекта. Применяется только на уровне запуска; неизвестное имя — предупреждение и полный профиль."
    },
    "presetChoices": {
      "type": "array",
      "items": { "type": "string", "minLength": 1 },
      "description": "Профили, между которыми человек переключается в строке состояния: встроенные или свои из profiles. Выбор человека сильнее preset, поэтому список — способ его ограничить: одно имя или пустой список оставляют только preset. Без поля — только builder. Применяется только на уровне запуска; профиль, который не собирается или не содержит переключателя, пропускается с предупреждением."
    },
    "profiles": {
      "type": "array",
      "description": "Свои профили состава — на выбор в preset. Применяются только на уровне запуска; id не может совпадать со встроенным профилем.",
      "items": {
        "type": "object",
        "additionalProperties": false,
        "required": ["id", "plugins"],
        "properties": {
          "id": {
            "type": "string",
            "minLength": 1,
            "description": "Имя профиля для preset и extends."
          },
          "name": { "type": "string", "minLength": 1, "description": "Имя для человека." },
          "extends": {
            "type": "string",
            "minLength": 1,
            "description": "Основа: встроенный профиль (например builder) или другой свой."
          },
          "plugins": {
            "type": "array",
            "items": { "type": "string", "minLength": 1 },
            "description": "Встроенные плагины профиля — идут после плагинов основы."
          },
          "providers": {
            "type": "object",
            "additionalProperties": { "type": "string", "minLength": 1 },
            "description": "Выбор провайдера: возможность → плагин, когда возможность дают двое."
          }
        }
      }
    },
    "plugins": {
      "type": "object",
      "additionalProperties": false,
      "description": "Поправки к составу профиля. Применяются только на уровне запуска; disable сильнее enable.",
      "properties": {
        "enable": {
          "type": "array",
          "items": { "type": "string", "minLength": 1 },
          "description": "Добавить к составу профиля."
        },
        "disable": {
          "type": "array",
          "items": { "type": "string", "minLength": 1 },
          "description": "Убрать из состава профиля."
        }
      }
    },
    "marketplace": {
      "type": "object",
      "additionalProperties": false,
      "description": "Каталог плагинов, которые предлагается ставить.",
      "properties": {
        "registry": {
          "type": "string",
          "format": "uri",
          "description": "Адрес каталога-JSON (http или https)."
        }
      }
    }
  }
}
